{
 "schema": "pnf.video.review.v1",
 "videoId": "2026-10-27-rats-a",
 "gate": "render-critic",
 "model": "claude-opus-5-5",
 "skillCommit": "e598b79",
 "prompt": "video/prompts/render-critic.md",
 "inputs": [
  "video-renders:2026-10-27-rats-a/Roger/strips (12 timeline sheets, 5 frames a second) and transcript.txt, hook 4 re-render"
 ],
 "score": {
  "faults": 0
 },
 "pass": true,
 "reasons": [
  "no faults found"
 ],
 "round": 0,
 "at": "2026-10-28T05:49:37-05:00"
}