{
 "schema": "pnf.video.review.v1",
 "videoId": "2026-10-27-rats-a",
 "gate": "buyer",
 "model": "claude-opus-5-5",
 "skillCommit": "bee08dd",
 "prompt": "video/prompts/buyer.md",
 "inputs": [
  "the script as heard and the Instagram caption, after the buyer fix round and the facts 'calls' fix"
 ],
 "score": {
  "tap": "yes"
 },
 "pass": true,
 "reasons": [
  "Rat complaints to Chicago 311 from the South Chicago community area more than tripled in the 30 days to Oct 26 (45 vs 14 in the same days last year), while citywide complaints are up 10.2% and 44 of 77 community areas are above last year.",
  "Yes: as a Chicago pest control or cleaning owner, a free neighborhood-by-neighborhood view of where rat complaints are rising is directly useful for deciding where to market, and the South Chicago number makes me want to check my own service areas.",
  "Rules check: nothing found. Every count is framed as complaints to 311 (script line 3, caption says 'not rats found'); only a community area is named, no building, block, business or person; it addresses pest control owners as an audience but sells no pest control; 311 is named as the source with no how-to; numbers check out (45/14 = 3.21x, +221.4%) and 'one to watch' is mild, not a promise or fake urgency. Minor clarity notes (non-blocking): the opening line 'more than tripled' comes before its period and source, which arrive in line 2; the citywide +10.2% and '44 of 77 running above last year' do not restate that they cover the same 30-day window, so a stranger has to assume it; the year is never said (implied current); 'community area' is a Chicago-specific term a non-local might not know, though a Chicago business owner likely would; a stranger is not told what ProofNotFluff is beyond 'see your neighborhood free'."
 ],
 "round": 1,
 "at": "2026-10-27T23:01:22-05:00"
}