{
 "schema": "pnf.video.review.v1",
 "videoId": "2026-10-27-rats-a",
 "gate": "render-critic",
 "model": "claude-opus-5-5",
 "skillCommit": "66d16a3",
 "prompt": "video/prompts/render-critic.md",
 "inputs": [
  "video-renders:2026-10-27-rats-a/Bill/strips (timeline sheets, 5 frames a second) and transcript.txt, render after the design and peak-limiter fix rounds"
 ],
 "score": {
  "faults": 0
 },
 "pass": true,
 "reasons": [
  "no faults found"
 ],
 "round": 0,
 "at": "2026-10-28T06:53:40-05:00"
}