{
 "schema": "pnf.video.review.v1",
 "videoId": "2026-10-27-rats-a",
 "gate": "facts",
 "model": "claude-opus-5-5",
 "skillCommit": "826eed5",
 "prompt": "video/prompts/facts.md",
 "inputs": [
  "tools/video_gates.py texts video/specs/2026-10-27-rats-a.json",
  "the spec's evidence list",
  "permits/rodents-chicago/weekly.json at the spec's commit"
 ],
 "score": {
  "numbers": 33,
  "mismatches": 1
 },
 "pass": false,
 "reasons": [
  "l3: '44 of the city's 77 neighborhoods' uses the wrong unit; the file counts 77 community areas. Both numbers are right (44 up of 77)."
 ],
 "round": 0,
 "at": "2026-10-27T22:16:21-05:00"
}