{
 "schema": "pnf.video.review.v1",
 "videoId": "2026-10-27-rats-a",
 "gate": "design",
 "model": "claude-opus-5-5",
 "skillCommit": "a5770b0",
 "prompt": "video/prompts/design.md",
 "inputs": [
  "video-renders:2026-10-27-rats-a/Eric/sheet.jpg and frame one (render after the design and peak-limiter fix rounds)",
  "design/DESIGN_DIRECTOR.md",
  "design/CAROUSEL_STANDARD.md"
 ],
 "score": {
  "first": 5,
  "hierarchy": 4,
  "type": 4,
  "color": 5,
  "spacing": 4,
  "polish": 4,
  "trust": 5,
  "average": 4.43
 },
 "pass": false,
 "reasons": [
  "0.00 to 4.63 s hook: count line competes with the area name; smaller count line.",
  "10.85 and 17.28 s map legend reads as part of the stat; move it under the map.",
  "Captions: word gaps about twice the font's space; use the font's own space and draw only the active word's box.",
  "10.85 s leader line ends against the SOUTH CHICAGO label; end it 16 px short.",
  "37.38 and 38.75 s +10.2% bar reads as a stray '|'; shared track or a 24 px minimum bar.",
  "Active-word boxes hug the glyphs; pad 8 px sides, 4 px top and bottom, 6 px radius, without moving words."
 ],
 "round": 1,
 "at": "2026-10-28T06:59:50-05:00"
}